ID	Category	Question	Answer_Text
Q94_BaseModel	Base_Model	What is the importance of security awareness training for Google employees?	curity awareness training for Google employees! Its absolutely vital and often overlooked. Heres a breakdown of why its so crucial:  **1. Protecting Google's Reputation & Trust (The Big Picture)**  * **Protecting Our Brand:** Google is globally known for its reputation. A security breach can seriously damage our brand  people trust us with their data and information.  Protecting against threats protects the trust we've built.** * **Maintaining Customer Trust:**  Customers are trusting Google with their privacy and information. A security breach can erode that trust, leading to reputational damage and potential loss of users. * **Maintaining Business Interests:** Without security, Google loses revenue, data, and access. Protecting our systems and data is essential for the company's long-term health.   **2. Beyond Just Security - It's a Human Element**  * **Employee Behavior is Key:** Security isn't just about technology; its about people. Its about *how* employees are behaving.  Humans are often the weakest link in security. * **Preventing Phishing and Social Engineering:** Employees are frequently targeted by phishing emails, fake websites, and
Q95_BaseModel	Base_Model	How does Google collaborate with other organizations to improve security?	tes with other organizations to improve security  its a massive and constantly evolving effort! Heres a breakdown of their approach and how they work with others, categorized into key areas:  **1. The Big Picture: Googles Security Strategy & Ecosystem**  * **Google's Global Security Vision:** At the core, Google's security strategy is globally focused. They arent just building security for one company, they want to build a truly secure internet for everyone.** This means theyre looking at a defense-in-depth approach  everything is interconnected to mitigate risk.  **2. Collaboration Points & Key Players**  Heres a breakdown of how Google collaborates with other organizations, primarily focused on improving security *across* the Internet, not just internal efforts:**  * **Open Source Security:** This is HUGE. Google releases crucial vulnerabilities publicly and incentivizes security researchers to find and report them. This allows security researchers to build upon existing work, identify new attack vectors, and rapidly improve defenses. Think of it as a massive, global bug bounty program. * **CERT Coordination (Cybersecurity Engineers):**  Google's CERT (Computer Emergency Response Team) works closely with
Q96_BaseModel	Base_Model	What are some of the future trends in infrastructure security?	tructure security! Its a rapidly evolving field, and there's a huge amount of exciting developments happening. Heres a breakdown of some of the most prominent future trends in infrastructure security:  **1. The Rise of AI & Autonomous Security:**  * **AI-Powered Threat Intelligence:** This is a massive trend.  Instead of manual analysis, AI can sift through massive datasets  logs, network traffic, threat feeds  to identify patterns, anomalies, and potential threats *before* they even happen. This includes:     * **Predictive Security:**  Using AI to anticipate attacks  predicting ransomware campaigns, identifying vulnerabilities based on historical data, predicting network surges.     * **Automated Incident Response:** AI can automate responses to security incidents, prioritizing and suggesting remediation based on severity and impact.     * **Cyber Defense AI:** Creating 'AI firewalls' that learn from attacks and automatically adjust security rules to defend against new threats. * **Autonomous Security Systems:**  Imagine systems that can autonomously monitor networks, detect malicious behavior, and respond to threats without constant human intervention.   **2. Quantum Computing Security:**  * **Protecting Critical Infrastructure from Quantum Computers:** This is a long-
Q97_BaseModel	Base_Model	How does Google's security approach differ from that of other large tech companies?	! There's a lot of shifting sands in the tech industry, especially when it comes to security. Google's approach is a bit different from other giants like Facebook/Meta, Amazon, or even Microsoft in some ways, largely due to their scale, culture, and strategic focus. Here's a breakdown of their approach, highlighting the key differences:  **Google's Security Approach - A Multi-Layered, Holistic Perspective**  Instead of focusing solely on a single security product, Google emphasizes a much broader approach built on:  * **Beyond Firewalls: Advanced Threat Intelligence & Sandboxing:**  This is *the* big difference. Google doesn't just build firewalls. They're obsessed with collecting and analyzing vast amounts of data  not just network traffic, but also user behavior, search trends, IP addresses, malware samples, and even dark web activity. Theyre constantly trying to understand the *context* of a threat  not just the attack itself, but *why* it's happening.  This feeds into their massive threat intelligence program. They are constantly evolving their sandboxing technology to detect attacks at their source, not just the output.  * **Deep Packet Inspection & Decryption
Q98_BaseModel	Base_Model	What are some of the key lessons learned from Google's experience in infrastructure security?	rned from Google's approach to infrastructure security, drawing from their extensive research and public disclosures, and considering their shifting priorities:  **1. The Illusion of Privacy - and Why It Matters More Than Ever**  * **The Core Principle:** Google's biggest shift from security to privacy has been profoundly impactful. They've consistently stated that protecting user privacy is *the* central goal of security. This isn't just about compliance; it's about building trust, which is fundamental to long-term success. * **Shadow Mode:** This is *the* most discussed and pivotal aspect. Theyve built a system where Google actively *secretly* monitors and analyzes data from users without explicitly asking for their consent  primarily to understand how people are *actually* using Google products.*  This isn't about spying; it's about understanding behavior and preventing abuse (like malicious attacks). * **Why It Matters:**  People are increasingly concerned about privacy.  The shift in policy to shadow mode, coupled with the massive amount of data collected, forces Google to deal with this pressure.  Its a constant game of balancing security, privacy, and the user experience.   **2.
Q99_BaseModel	Base_Model	What is the role of the Google Security team in maintaining the security of the infrastructure?	le Security team in maintaining the security of the infrastructure. Its a massive and incredibly complex undertaking, and its far more than just a security team! Heres a breakdown of what they do and why its so critical:  **1. The Big Picture - Protecting the Entire Ecosystem**  Googles security team doesnt just focus on one product or platform. Theyre responsible for protecting *everything*  the search engine, YouTube, Android, Gmail, Cloud, Google Cloud, the entire infrastructure  ensuring everyone, everywhere, is safe and secure.  **Heres a breakdown of their roles and responsibilities:**  * **Security Strategy & Roadmap:** They develop and evolve the overall security strategy for Google's products. This involves anticipating threats, researching vulnerabilities, and setting the overall tone for security across all services. * **Threat Intelligence:** This is *huge*. Google constantly monitors the internet for malicious activities  analyzing huge amounts of data for patterns, emerging threats, and vulnerabilities.  This includes:     * **Threat Intelligence:** They use threat intelligence feeds, collaborations with security researchers, and internal monitoring to understand what's happening on the network, not just
Q100_BaseModel	Base_Model	What are some of the key areas of focus for Google's security team?	us for Google's security team  its a constantly evolving and incredibly complex space! Here's a breakdown of what they're generally looking at, categorized for easier understanding:  **1. Fundamental Security - The Big Picture**  * **Deep Packet Inspection & Threat Intelligence:** This is *the* core of their work. They're constantly scanning networks for malicious traffic patterns, identifying novel threats (zero-day attacks), and building a deep understanding of how attackers are probing systems. They're feeding this intelligence back to Google's threat intelligence teams for prioritized investigations. * **Zero-Day Attacks:** This is a *massive* challenge. They're trying to anticipate attacks *before* they happen, not just reacting to them.  They're experimenting with techniques like sandboxing, proxying, and other methods to detect and analyze unknown threats that haven't been seen before. * **Privacy:** Google's mission is to protect user privacy. They need to balance security with privacy, a tricky space given the massive amounts of data they collect. * **Endpoint Security:** Ensuring the security of all Google's products (Android, Chrome, Google Search, YouTube,
Q101_BaseModel	Base_Model	How does Google's security approach impact its users?	y approach impacts its users and what that means for them. Its a complex and often debated topic, but here's a breakdown of what Google does, and what that means for your experience:  **1. The Core Philosophy  Privacy First (with a Twist)****  At its heart, Googles approach is built on the principle of **privacy**.  They aren't aiming to be the *most* privacy-preserving company in the world, but rather to help users *control* their privacy. This is a *huge* shift from the past where data was often seen as a commodity.  *   **Data Minimization:** They aggressively minimize the amount of data they collect. They prioritize "just-in-use" data  the data youre *using* rather than the data itself. Think of it less about tracking every click and more about anonymizing data for analysis. *   **Private Cookies:** They understand that users are increasingly skeptical of tracking. They don't rely heavily on third-party cookies.  Instead, they use technologies like the Private Cookies to allow you to see your own Google activity privately on your computer or mobile device without affecting other people'
Q102_BaseModel	Base_Model	What are some examples of security features available in Google services?	features offered by Google services, and how they work.  Google's focus on security is incredibly deep and constantly evolving, so here's a breakdown categorized by area:  **1. Authentication & Access Control:**  * **Two-Factor Authentication (2FA/ MFA):** This is HUGE. Google relies on a multi-layered system.  Instead of just a password, youre prompted for multiple verification factors before you can access services. This includes:     * **Google Authenticator:**  A device that can be used to create Google accounts, or to authenticate across multiple Google accounts.     * **Fingerprint authentication:**  Google analyzes your fingerprint (from the security prompts on your phone or device) to prove you are the user. This is much more secure than using a password.     * **Device Authentication:** The system checks your device (phone, computer) for fingerprints, device ownership, and other factors to ensure the service is genuinely yours.  * **Google Sign-in:**  Using Google accounts, you can control who can access what Google services (Drive, Gmail, YouTube, etc.) through Google Workspace. It also allows for advanced permission controls.  **2.
Q103_BaseModel	Base_Model	How does Google address the security challenges posed by emerging technologies?	ating question! Google is constantly grappling with security challenges across all its technologies, and they're investing *enormously* in it. Here's a breakdown of how they address those challenges, and what they're focusing on:  **1. The Big Picture - A Multi-Layered Approach**  Google doesn't just build security as a bolt-on afterthought. They approach it as a fundamental part of the entire platform, not just a set of rules. They emphasize a defense-in-depth approach - where they build security into *every* layer of their system, not just at the top.  **Here's a breakdown of their key strategies:**  * **Beyond Firewalls:  Beyond Basic Security**  They're moving far beyond just basic firewalls. They're incorporating techniques like:     * **Self-Healing:** Googles Chronicle system is a prime example. It constantly monitors the entire network for threats, learns from its own mistakes (and from Googles own data), and continuously updates its threat intelligence. Think of it as a highly advanced, continuously learning security sandbox.     * **Zero-Trust:**  This is *huge*. Theyre moving
Q104_BaseModel	Base_Model	What are some of the key challenges faced by Google in securing its mobile devices?	faces when securing mobile devices, particularly its devices that run Android. It's a constantly evolving landscape with a lot going on! Here's a breakdown of the key challenges:  **1. Security Threats Beyond the App Store:**  * **Malware & Ransomware:** This is *the* big one. Android OS vulnerabilities are constantly exploited.  Malware attacks are rampant on mobile devices, and Google is constantly battling to prevent them. The sheer volume of mobile devices connecting to the internet makes this a constant battle. Think of the recent ransomware attacks on major carriers (like Telus, Verizon) that demonstrated just how vulnerable these devices can be. * **App Ecosystem Risks:** Google Play Store is a goldmine for malicious apps.  The Play Store has a reputation for letting bad apps get through to users, and bad developers often exploit these vulnerabilities to spread malware, steal data, or gain unauthorized access. * **Phishing & Social Engineering:**  Android is a huge platform for phishing attacks, as users often trust apps with access to sensitive information. These attacks are sophisticated and highly targeted  attackers can impersonate legitimate apps to trick users into revealing information or enabling malicious activity. * **Rooting/
Q105_BaseModel	Base_Model	How does Google protect user data stored in its cloud services?	user data in its cloud services. Its a pretty complex and constantly evolving process, but heres a breakdown of their approach, focusing on key aspects and addressing common concerns:  **1. Data Encryption & Security - The Foundation**  * **Encryption at Rest (Data in the Cloud):** All data stored in Google's data centers is encrypted at rest. This means data is encrypted when it's not being accessed, and only protected when it *is* being accessed.  This happens automatically for many services  think of how Gmail encrypts your emails, documents, and photos. * **Data at Rest:** They use advanced encryption algorithms for all data stored in Google Cloud  whether it's in databases, object storage (like Cloud Storage), or even data in Google's internal infrastructure. * **TLS/SSL:**  All communications between your devices and Google's servers (and vice-versa) are secured with TLS/SSL. This protects data in transit.  **2. Data Protection & Privacy  The Bigger Picture**  This is where it gets more nuanced. Here's a breakdown of Googles approaches:  * **Privacy by Design:** This is a
Q106_BaseModel	Base_Model	What is Google's approach to data privacy?	data privacy. Its a complex and constantly evolving area, and it's a really important and often misunderstood area. Heres a breakdown of their approach, based on publicly available information, news, and their own statements:  **Overall Philosophy & Goals:**  Google's primary goal isnt to keep all data private in the sense of "keeping it secret." Instead, they frame privacy as *preserving user experience* and enabling them to improve their services for everyone. They want to provide a seamless experience without actively tracking users to gather data for their own purposes.  Heres the breakdown of their strategies:  **1. Privacy-First Design (Focus on Contextual Privacy)**  * **Dont Just Collect Data:**  Instead of obsessing over individual data points, Google prioritizes understanding *how* people are using the internet.  They emphasize the context of use, not the data itself. * **Limited Data Collection:** Google emphasizes "interest based" data  focusing on what *users* are actively doing, not what they are *thinking* about, and how they're interacting with the internet. * **Focus on Small Data Sets:** They don'
Q107_BaseModel	Base_Model	How does Google handle user security incidents?	ser security incidents. It's a complex and constantly evolving process, but heres a breakdown of whats going on  and what Google is doing to protect users and prevent issues:  **1. Monitoring and Detection  The Constant Watch**  * **Deep Monitoring:** Google employs incredibly sophisticated monitoring systems across its entire infrastructure. This isnt just about logging  its about constantly analyzing data for unusual patterns. They use:     * **Log Collection:** They collect a *massive* amount of logs from everywhere: servers, apps, user behavior, network traffic, search queries, Google Play Store, Android, etc. This data is incredibly detailed.     * **Anomaly Detection:** Machine learning models constantly analyze huge volumes of data for anomalies - things that deviate from normal behavior. This includes:         * **Fraud Detection:**  Detecting unusual activity like sudden spikes in searches related to a new product, suspicious IP addresses, unusual API calls, or password changes.         * **Malware Detection:** They's actively scanning for malicious software, phishing attempts, and other threats.         * **Payment Fraud Detection:** Monitoring payment gateway activity for compromised accounts or suspicious transactions. * **
Q108_BaseModel	Base_Model	What is Google's approach to security research?	ch to security research, drawing from various sources and reports:  **Overall Philosophy & Emphasis**  Google prioritizes security *not just as a technical challenge*, but as a fundamental aspect of their core business and a critical component for users. They genuinely believe that security is essential for innovation and doesnt just focus on "preventing exploits"  its about enabling innovation *because* of security.  This shift from purely defensive to proactive is a huge part of their strategy.  Here's a breakdown of their approach, influenced by several key areas:  **1. The "Security First" Approach  Rooted in AI & Learning**  * **Foundation - The Model-Based Security Research Program:** This is arguably their most impactful initiative. Google's AI/ML team, particularly the Large-Scale Security Research Program (LSRP), is pushing the boundaries of security. This isnt just about building better detection systems; its about *understanding* the underlying threat landscape, anticipating attacks, and creating models that allow Google to understand *how* attackers are trying to break into systems.     * **Why its significant:** They're trying to create the "perception of
Q109_BaseModel	Base_Model	How does Google balance security and innovation in its product development?	really complex one! Google's approach to balancing security and innovation is a continuous, evolving process, and its more of a deliberate strategy than a simple switch. Here's a breakdown of how they do it, and why it's challenging:  **The Core Philosophy - "Safety & Progress"**  At the heart of Google's approach is the idea that **security is foundational to innovation.** They believe that without security, innovation can quickly become a chaotic mess  users, data, systems  can be significantly compromised, and that can impact the entire ecosystem.  Its less about a perfectly secure product and more about building a system that can *handle* a range of security threats while still allowing for rapid experimentation, research, and the development of new features.**  Here's a breakdown of how they try to balance those two:  **1. Security as a Layer, Not a Blockbuster:**  * **Layered Approach:**  Instead of one huge, monolithic security system, they employ a layered approach, thinking about security at multiple levels  data security, network security, user privacy, API security, supply chain security for their own products, and even (to a
Q110_BaseModel	Base_Model	What are some of the key takeaways from Google's security best practices for other organizations?	st practices from Googles perspective  and importantly, how those apply to other organizations  thinking about security from a highly considered, not just "do these things" perspective. Lets look at the core principles and areas they emphasize:  **1.  Prioritize Privacy & Data Minimization (Even for Large Scale)**  * **Privacy First:** Google fundamentally believes in privacy. They emphasize data minimization  minimizing the amount of data they collect and store.  They're constantly working on techniques like differential privacy and federated learning to help users understand their data and control its use. This impacts everything from consent models to data usage in advertising. * **Small Data Footprint:**  Theyre extremely wary of "big data" and the potential for misuse. They've taken immense steps to limit the amount of data they can collect and process, focusing on privacy-preserving technologies.   **2.  Security Beyond Firewalls  Holistic Approach**  * **Defense in Depth:** They don't just build firewalls  they build *multiple* layers. Theyre heavily invested in proactive security  thinking ahead of attacks. * **Sandboxing:** They've built impressive sandboxes for their
Q111_BaseModel	Base_Model	How can users stay informed about Google's security practices?	ut Google's security practices! It's a really important and constantly evolving area. Here's a breakdown of how users can stay informed, broken down into categories:  **1. Official Google Security Blogs & Resources:**  * **Google Security Blog:** This is *the* go-to source for official information. It regularly posts about:     * **New Security Features:** They often showcase updates and improvements to Google's security infrastructure, like those behind the scenes to protect user data. (https://security.google.com/)     * **Security Research:** They share research into new attack vectors, vulnerabilities being actively investigated, and how they're thinking about security threats.     * **Incident Reports:** This is where you'll find out about breaches, ransomware attacks, and other security incidents that have happened. (https://securityblog.google.com/)     * **Security Updates for Developers:**  This is critical for developers learning about how to build secure applications and services. (https://product.google.com/security/)   **2. Google Safety & Privacy Blog:**  This is a great place for:     * **Privacy Considerations:** Shows how Google handles user privacy
Q112_BaseModel	Base_Model	What are some of the future directions for Google's infrastructure security?	ns for Google's infrastructure security, considering the evolving threat landscape and Google's stated priorities:  **1. Beyond Traditional Firewalls: The Moving Beyond the Basics**  * **Multi-Layered Security Beyond Just Firewalls:** Google is shifting away from a purely firewall-based approach and moving towards a more layered defense. They're emphasizing proactive defense, not just reactive protection. * **AI-Powered Threat Hunting & Anomaly Detection:**  Instead of just looking for known threats, Google wants to build systems that *learn* from the data they collect  and the data they *don't* collect  to identify malicious activity before it happens. This includes:     * **Deep Packet Inspection (DPI) with AI:** Going beyond simple packet inspection to understand the *intent* of the traffic  not just the content. AI will analyze network behavior, identify unusual patterns, detect zero-day attacks, and understand the context of communications.     * **Zero-Day Exploitation:** Google is exploring techniques to detect and exploit vulnerabilities in software *before* attackers can exploit them.  This involves creating "sandboxes" for experiments. * **Sandboxing for Advanced Attacks:** They want to
Q113_BaseModel	Base_Model	What are some of the key principles of Google's security culture?	lture  its a really fascinating and surprisingly deep one! It's more than just "security is important"  its woven into the very fabric of how they approach everything. Here's a breakdown of some of the key principles and aspects of that culture:  **1.  Privacy as a Fundamental Value (and a Core Principle):**  * **Data Minimization:** This is *huge*.  They are extremely careful about what data they collect and how they use it. They prioritize minimizing data collection and focusing on what's *actually* useful for users, rather than hoarding all data. Theyve actively stated that users should not be concerned about privacy, even when theyre collecting lots of data. This is a very deliberate strategy, often controversial in the tech world. * **Privacy-First Design:**  They constantly think about how data affects privacy  not just in terms of protecting user data, but also how much they can *influence* and *control* the datas use.   **2.  The "Trust" Philosophy:**  * **Trust is Everything:** This is arguably the cornerstone. Google believes in a "trust-based" culture. They
