ID	Category	Question	Answer_Text
Q1_GroundTruth	Ground_Truth	What is the purpose of this document?	This document provides an overview of how security is designed into Google's technical infrastructure. It's intended for security executives, security architects, and auditors.
Q2_GroundTruth	Ground_Truth	What are the key aspects of Google's global technical infrastructure?	Google's global technical infrastructure is designed to provide security throughout the information processing lifecycle. It ensures secure deployment of services, secure data storage with privacy safeguards, secure communication between services, secure and private communication with customers over the internet, and safe operation for Google engineers.
Q3_GroundTruth	Ground_Truth	How does Google use its infrastructure to build internet services?	Google leverages its secure infrastructure to build both consumer services like Google Search, Gmail, and Google Photos, and enterprise services like Google Workspace and Google Cloud.
Q4_GroundTruth	Ground_Truth	What are some examples of security products and services that resulted from Google's internal security innovations?	BeyondCorp, a zero-trust security model, is a direct result of Google's internal implementation.
Q5_GroundTruth	Ground_Truth	What are the different layers in Google's infrastructure security design?	The infrastructure security is designed in progressive layers, including low-level infrastructure, service deployment, data storage, internet communication, and operations.
Q6_GroundTruth	Ground_Truth	How does Google secure the physical premises of its data centers?	Google designs and builds its own data centers with multiple layers of physical security, including tightly controlled access, biometric identification, metal detection, cameras, vehicle barriers, and laser-based intrusion detection systems.
Q7_GroundTruth	Ground_Truth	What security measures are taken inside the data center?	Inside the data center, Google implements additional controls to ensure that physical access to servers is protected and monitored.
Q8_GroundTruth	Ground_Truth	How does Google address security when hosting servers in third-party data centers?	Google aligns with the same regulatory standards in third-party data centers as in its own. They ensure Google-controlled physical security measures and connectivity on top of the data center operator's security layers.
Q9_GroundTruth	Ground_Truth	What are the key aspects of Google's hardware design and provenance?	Google designs its server boards and networking equipment, carefully vets component vendors, and audits the security properties of components. They also develop custom chips, including the Titan hardware security chip, for enhanced hardware-level security.
Q10_GroundTruth	Ground_Truth	What is the Titan hardware chip and where is it used?	The Titan chip is a hardware security chip used in Google servers, devices, and peripherals for hardware-level authentication and identification.
Q11_GroundTruth	Ground_Truth	How does Google secure the boot stack and machine identity of its servers?	Google uses various technologies to ensure the intended software stack boots on its servers, implementing industry-leading controls at each step to enforce expected boot states and protect customer data.
Q12_GroundTruth	Ground_Truth	What efforts does Google make to improve server security with each hardware generation?	Google strives to continually improve its servers with each generation and bring these improvements to the industry through engagement in standards processes with the Trusted Computing Group and DMTF.
Q13_GroundTruth	Ground_Truth	How does Google provide unique identities to its servers?	Each server in the data center has a unique identity tied to the hardware roots of trust and software it boots. This identity is used for authenticating API calls, mutual server authentication, and transport encryption.
Q14_GroundTruth	Ground_Truth	What is ALTS and how is it used?	ALTS (Application Layer Transport Security) is a system developed by Google for securing RPC communications within its infrastructure. It uses machine identities for authentication and encryption.
Q15_GroundTruth	Ground_Truth	How does Google manage server identities?	Server identities can be centrally revoked in response to security incidents. Certificates and keys are routinely rotated, and old ones revoked.
Q16_GroundTruth	Ground_Truth	What automated systems are used for server security management?	Google has automated systems to ensure servers run up-to-date software, detect and diagnose problems, ensure machine integrity with verified boot and attestation, restrict access to credentials, and remove or repair compromised machines.
Q17_GroundTruth	Ground_Truth	What is Borg and how does it relate to service deployment?	Borg is a cluster orchestration service that controls the services running directly on Google's infrastructure.
Q18_GroundTruth	Ground_Truth	What is a zero-trust security model and how does Google implement it?	A zero-trust security model assumes no trust by default, whether devices or users are inside or outside the network. Google implements this model by not assuming trust between services running on its infrastructure.
Q19_GroundTruth	Ground_Truth	How does Google handle data from different customers on its shared infrastructure?	Customer data is distributed across shared infrastructure, composed of tens of thousands of homogeneous machines, except in specific cases like using Google Cloud's sole-tenant nodes for Compute Engine.
Q20_GroundTruth	Ground_Truth	How do Google Cloud and Google Workspace address regulatory requirements around data residency?	Both services support regulatory requirements. Google Cloud provides specific features for implementing data residency and sovereignty, while Google Workspace allows choosing a geographic location for data storage.
Q21_GroundTruth	Ground_Truth	How does Google ensure service identity, integrity, and isolation?	Services use cryptographic authentication and authorization for inter-service communication, providing strong access control. Ingress and egress filtering help prevent IP spoofing. Each service has a service account identity with cryptographic credentials for authentication.
Q22_GroundTruth	Ground_Truth	What isolation techniques are employed to protect services from each other?	Google uses various isolation and sandboxing techniques like Linux user separation, language-based sandboxes, kernel-based sandboxes, gVisor, and hardware-based virtualization. More layers of isolation are used for riskier workloads.
Q23_GroundTruth	Ground_Truth	How are sensitive services handled in terms of isolation?	Sensitive services, like the cluster orchestration service and key management services, run exclusively on dedicated machines.
Q24_GroundTruth	Ground_Truth	What is Confidential Computing and how does it enhance security in Google Cloud?	Confidential Computing services in Google Cloud provide stronger cryptographic isolation for workloads and data in use. This is supported for Compute Engine VMs and GKE nodes.
Q25_GroundTruth	Ground_Truth	How does Google manage inter-service access?	Service owners can create lists of other services allowed to communicate with their service. This access management is enforced by the Google infrastructure, including audit logging, justifications, and access restrictions.
Q26_GroundTruth	Ground_Truth	How is access control implemented for Google engineers?	Google engineers receive individual identities and services can be configured to allow or deny their access based on these identities.
Q27_GroundTruth	Ground_Truth	How does Google manage identities for machines, services, and employees?	All identities are in a global namespace maintained by the infrastructure. A workflow system with approval chains, logging, and notifications is used to manage these identities.
Q28_GroundTruth	Ground_Truth	How does the infrastructure enforce secure access-management processes?	The infrastructure can enforce multi-party authorization, using the two-person rule to ensure sensitive operations require approval from two authorized engineers.
Q29_GroundTruth	Ground_Truth	How does Google ensure the security of communication between its services?	The infrastructure provides confidentiality and integrity for RPC data on the network. All Google Cloud virtual networking traffic is encrypted, with exemptions only for high-performance workloads not crossing data center security boundaries.
Q30_GroundTruth	Ground_Truth	How does Google manage access to end-user data in Google Workspace?	The infrastructure provides end-user permission tickets that prove a service is acting on behalf of a specific user. This allows services to only return data for the user specified in the ticket.
Q31_GroundTruth	Ground_Truth	How does Google's central user identity service work?	The identity service verifies user logins and issues user credentials, which are then presented for subsequent requests to the infrastructure. The service also issues short-lived end-user context tickets for RPCs related to the user's request.
Q32_GroundTruth	Ground_Truth	How is access management implemented for end-user data in Google Cloud?	Similar to Google Workspace, a central user identity service authenticates service accounts and issues end-user context tickets. Google Cloud uses IAM and context-aware products like Identity-Aware Proxy for access management.
Q33_GroundTruth	Ground_Truth	What steps are involved in the access management process in Google Cloud?	Requests are routed through Google Front End or Cloud Front End services, then checked for IAM permissions, access transparency, Cloud Audit Logs, quotas, billing, and VPC Service Controls security perimeters before reaching Google Cloud backend services.
Q34_GroundTruth	Ground_Truth	How does Google protect data at rest?	Google's infrastructure provides storage services and distributed file systems with various layers of encryption. Data is encrypted before writing to physical storage, using keys managed by Google. Hardware encryption is also used in storage devices.
Q35_GroundTruth	Ground_Truth	What is the process for cleaning decommissioned storage devices?	Decommissioned storage devices undergo a multi-step cleaning process with two independent verifications before physical disposal or destruction.
Q36_GroundTruth	Ground_Truth	How do Google Cloud and Google Workspace address key management for data at rest?	Both services provide key management services, where users can own and manage their own cryptographic keys. Google Cloud offers Cloud KMS, while Google Workspace supports client-side encryption.
Q37_GroundTruth	Ground_Truth	What is the process for deleting data in Google's infrastructure?	Deletion typically involves marking keys or data for deletion, allowing for recovery from unintentional deletions. When an end-user deletes their account, associated data is scheduled for deletion.
Q38_GroundTruth	Ground_Truth	How does Google secure communication between the internet and its services?	Google isolates its infrastructure from the internet using a private IP address space. Only a subset of machines is exposed to external internet traffic, allowing for additional protections like DoS attack defenses.
Q39_GroundTruth	Ground_Truth	What is the Google Front End service and how does it function?	The Google Front End (GFE) is an infrastructure service that handles TLS connections, provides DoS protection, and acts as a smart reverse-proxy frontend for services needing external access. It uses the RPC security protocol for internal communication.
Q40_GroundTruth	Ground_Truth	What are Cloud Front Ends and how do they relate to customer VMs in Google Cloud?	Cloud Front Ends are specific GFEs located in the same cloud region as customer VMs for minimizing latency. They allow customer VMs to communicate with Google APIs and services without needing external IP addresses.
Q41_GroundTruth	Ground_Truth	How does Google protect its infrastructure from DoS attacks?	Google has multi-tier, multi-layer DoS protection, including hardware and software load balancers that report to a central DoS service for attack detection and mitigation.
Q42_GroundTruth	Ground_Truth	How does Google's central identity service contribute to secure communication?	The service authenticates end users through the Google login page, verifying username, password, and other risk factors. It issues credentials for subsequent requests.
Q43_GroundTruth	Ground_Truth	What are some security measures for user authentication?	Users can utilize second factors like OTPs or phishing-resistant security keys like the Titan Security Key, which supports the FIDO U2F open standard.
Q44_GroundTruth	Ground_Truth	How does Google ensure safe software development?	Google uses libraries that prevent certain security bugs, automated tools like fuzzers and static analysis, and manual security reviews conducted by experts.
Q45_GroundTruth	Ground_Truth	What is Google's Vulnerability Rewards Program?	This program rewards individuals who discover and report bugs in Google's infrastructure or applications. It encourages security researchers to help improve Google's security.
Q46_GroundTruth	Ground_Truth	What is Project Zero and how does it contribute to security?	Project Zero is a team of Google researchers focused on researching zero-day vulnerabilities, including Spectre and Meltdown, and submitting fixes for open source software.
Q47_GroundTruth	Ground_Truth	How does Google protect its source code?	Source code is stored in repositories with built-in source integrity and governance, ensuring auditability. Binary Authorization for Borg (BAB) enforces the use of authorized and reviewed code for deployments.
Q48_GroundTruth	Ground_Truth	What are the key functions of Binary Authorization for Borg (BAB)?	BAB ensures reviewed and authorized code is used for deployments, particularly for code accessing user data, enforces minimum standards, and prevents malicious modifications to source code.
Q49_GroundTruth	Ground_Truth	How does Google protect its employees' devices and credentials?	Google mandates the use of U2F-compatible security keys for second-factor authentication, monitors employee devices for security patches and application installations, and uses zero-trust security for access control.
Q50_GroundTruth	Ground_Truth	How does Google reduce insider risk?	Google limits and monitors activities of employees with administrative access, uses automation to minimize privileged access, and employs two-party approvals for sensitive actions.
Q51_GroundTruth	Ground_Truth	How does Google log and monitor employee access to end-user information?	Access logs are collected through low-level infrastructure hooks, and security teams monitor access patterns and investigate unusual events.
Q52_GroundTruth	Ground_Truth	What measures does Google Cloud take to protect user data and establish trust?	Google Cloud uses Access Transparency for monitoring access, Access Approval for explicit approval requirements for sensitive access, and BeyondProd for protecting user data and establishing trust in services.
Q53_GroundTruth	Ground_Truth	What is the Threat Analysis Group and how does it contribute to security?	The Threat Analysis Group at Google monitors threat actors and their tactics, aiming to improve the safety and security of Google products and share intelligence with the online community.
Q54_GroundTruth	Ground_Truth	What are the Google Cloud Threat Intelligence for Google Security Operations and VirusTotal?	These are tools for monitoring and responding to malware. Google Cloud Threat Intelligence provides threat intelligence for Google Security Operations, while VirusTotal is a malware database and visualization solution.
Q55_GroundTruth	Ground_Truth	How does Google monitor threats and potential security incidents?	Google uses sophisticated data processing pipelines to integrate host-based, network-based, and service signals. Rules and machine intelligence generate warnings, which are then triaged, investigated, and responded to by incident-response teams.
Q56_GroundTruth	Ground_Truth	What is the role of Red Team exercises in Google's security strategy?	Red Team exercises are used to measure and improve the effectiveness of Google's detection and response mechanisms by simulating attacks.
Q57_GroundTruth	Ground_Truth	What is the primary focus of Google's infrastructure security design?	Google's infrastructure security design prioritizes the protection of its users' data and services from various threats, including DoS attacks, unauthorized access, and malicious software.
Q58_GroundTruth	Ground_Truth	How does Google protect against DoS attacks?	Google employs a multi-tier, multi-layer DoS protection system. This includes hardware and software load balancers that monitor incoming traffic and a central DoS service that can configure the load balancers to drop or throttle attack traffic.
Q59_GroundTruth	Ground_Truth	What is the role of the central identity service in user authentication?	The central identity service handles user authentication by verifying usernames and passwords, potentially challenging users for additional information based on risk factors, and issuing credentials like cookies and OAuth tokens for subsequent actions.
Q60_GroundTruth	Ground_Truth	What are some examples of second-factor authentication methods supported by Google?	Google supports various second-factor authentication methods, including OTPs (One-Time Passwords) and phishing-resistant security keys like the Titan Security Key, which uses the FIDO Universal 2nd Factor (U2F) standard.
Q61_GroundTruth	Ground_Truth	How does Google ensure safe software development?	Google utilizes libraries and frameworks that prevent specific security bugs, employs automated tools like fuzzers and static analysis tools, and conducts manual security reviews with experts in various security domains.
Q62_GroundTruth	Ground_Truth	What is the purpose of the Vulnerability Rewards Program?	The Vulnerability Rewards Program encourages security researchers to identify and report vulnerabilities in Google's infrastructure and applications by offering rewards for their findings.
Q63_GroundTruth	Ground_Truth	What is Project Zero, and what is its role in security?	Project Zero is a team of Google researchers dedicated to finding and addressing zero-day vulnerabilities, focusing on issues like Spectre and Meltdown.
Q64_GroundTruth	Ground_Truth	What are the key features of Binary Authorization for Borg (BAB)?	BAB enforces that deployed code is reviewed and authorized, meets minimum standards, and limits the possibility of malicious modifications, providing a traceable audit trail.
Q65_GroundTruth	Ground_Truth	How does Google protect employee devices and credentials?	Google mandates the use of U2F-compatible security keys for authentication, monitors employee devices for security patches and installed applications, and utilizes a zero-trust security approach for access management.
Q66_GroundTruth	Ground_Truth	What is the concept of zero-trust security?	Zero-trust security assumes that no user or device is inherently trusted. Access to resources is granted based on strict verification and authorization policies, regardless of network location or device type.
Q67_GroundTruth	Ground_Truth	How does Google mitigate insider risk?	Google limits and monitors administrative access, automates tasks to reduce privileged access needs, provides limited debugging APIs, and requires two-party approvals for sensitive actions.
Q68_GroundTruth	Ground_Truth	How does Google monitor employee access to end-user information?	Google logs employee access to end-user information using low-level infrastructure hooks and monitors access patterns for any unusual events.
Q69_GroundTruth	Ground_Truth	What are some tools available in Google Cloud for threat monitoring?	Google Cloud offers Google Cloud Threat Intelligence for Google Security Operations, a team of threat researchers providing intelligence, and VirusTotal, a malware database and analysis tool.
Q70_GroundTruth	Ground_Truth	What is the Threat Analysis Group at Google?	The Threat Analysis Group monitors threat actors, their tactics, and techniques, improving the safety and security of Google products and sharing intelligence with the online community.
Q71_GroundTruth	Ground_Truth	What is the role of intrusion detection in Google's security strategy?	Google utilizes sophisticated data processing pipelines to integrate signals from various sources and use rules and machine intelligence to identify potential security incidents. Dedicated teams investigate and respond to these incidents.
Q72_GroundTruth	Ground_Truth	How does Google measure and improve the effectiveness of its security mechanisms?	Google conducts Red Team exercises to simulate attacks and evaluate the effectiveness of its detection and response mechanisms.
Q73_GroundTruth	Ground_Truth	What are some key principles of Google's infrastructure security design?	Key principles include multi-layered defenses, proactive threat monitoring, comprehensive user authentication, secure software development, and employee device and credential protection.
Q74_GroundTruth	Ground_Truth	What is the significance of Google's investment in open security standards like FIDO U2F?	Google's support for open standards like FIDO U2F promotes interoperability and strengthens security across the internet by encouraging wider adoption of stronger authentication methods.
Q75_GroundTruth	Ground_Truth	How does Google's security strategy go beyond just technical measures?	Google's security strategy involves a combination of technical measures, security awareness programs for employees, collaborations with the security community, and ongoing research and development.
Q76_GroundTruth	Ground_Truth	What is the importance of transparency in Google's security practices?	Google's commitment to transparency, including the publication of security reports and the Vulnerability Rewards Program, builds trust with users and encourages community involvement in improving security.
Q77_GroundTruth	Ground_Truth	What are some of the challenges faced by Google in maintaining its infrastructure security?	Challenges include the ever-evolving threat landscape, the need to balance security with user experience, and the complexity of managing a large-scale infrastructure.
Q78_GroundTruth	Ground_Truth	How does Google ensure that its security practices are continually evolving?	Google continuously invests in research and development, monitors threat trends, and collaborates with industry partners to adapt its security practices to emerging threats and vulnerabilities.
Q79_GroundTruth	Ground_Truth	What is the significance of Google's efforts to protect its own infrastructure in the context of the broader internet ecosystem?	Google's efforts to secure its infrastructure contribute to the overall security of the internet ecosystem by providing a robust platform for users and services, while also sharing knowledge and best practices with the community.
Q80_GroundTruth	Ground_Truth	How does Google balance security and user experience?	Google aims to provide secure services without significantly impacting user experience by carefully designing security measures to be transparent and efficient. For example, they use multi-factor authentication without creating excessive friction for users.
Q81_GroundTruth	Ground_Truth	What are some ways that users can contribute to the security of Google's infrastructure?	Users can contribute by being aware of phishing attempts, using strong passwords, enabling multi-factor authentication, and reporting any suspicious activity.
Q82_GroundTruth	Ground_Truth	What is the future of infrastructure security design at Google?	The future of infrastructure security design at Google likely involves further adoption of artificial intelligence and machine learning for threat detection and response, increased reliance on automation to reduce human error, and continued collaboration with the security community.
Q83_GroundTruth	Ground_Truth	What are some of the ethical considerations involved in Google's security practices?	Google faces ethical considerations related to data privacy, transparency of security practices, and the responsible use of AI and surveillance technologies.
Q84_GroundTruth	Ground_Truth	How does Google balance the need for security with the need for innovation?	Google strives to find a balance by integrating security considerations into the development process from the beginning, using secure development practices, and actively seeking out vulnerabilities to mitigate risks early on.
Q85_GroundTruth	Ground_Truth	What is the impact of Google's security practices on its business?	Google's robust security practices are crucial for maintaining user trust, protecting its brand reputation, and ensuring the continued viability of its services.
Q86_GroundTruth	Ground_Truth	What are some of the key takeaways from Google's infrastructure security design?	Key takeaways include the importance of layered security, proactive threat monitoring, secure software development practices, and a strong focus on user authentication and employee device protection.
Q87_GroundTruth	Ground_Truth	How can other organizations learn from Google's approach to infrastructure security?	Organizations can learn from Google's approach by adopting similar principles, such as layered security, continuous monitoring, and a focus on secure development practices, while also adapting those principles to their specific needs and contexts.
