ID	Category	Question	Answer_Text
Q34_BaseModel	Base_Model	How does Google protect data at rest?	est for Google! It's a really complex and multi-layered effort, and it's far more than just a simple "encrypting everything." Here's a breakdown of how Google protects data at rest:  **1. Encryption - The Foundation**  * **Encryption at the Hardware Level:** This is the core of it all. Google encrypts data at the level of the hard drives, SSDs (Solid State Drives), and other storage media where your data is actually stored. This means encrypting the data itself, *in addition to* encryption for the data *in* the storage.  Different encryption methods are used for various data types:    * **AES Encryption:** Google uses advanced encryption algorithms like AES (Advanced Encryption Protocol) for protecting data at rest.  This is used for everything from email content to large datasets.    * **BitLocker:** This is a built-in Google service that encrypts individual files and folders, protecting them even if they's stolen or compromised. It has a user-friendly experience, making it simple for everyone to use.  **2. Data Loss Prevention (DLP) - Protecting the Silent Threat**  This is where it gets
Q35_BaseModel	Base_Model	What is the process for cleaning decommissioned storage devices?	ned storage devices  a process that can be a bit of a mixed bag, but it's a vital part of a successful data recovery and upgrade. Heres a breakdown of the process, keeping in mind its a careful and potentially complex undertaking:  **1. Initial Assessment & Planning (Crucial First Steps)**  * **Determine the Scope:** Before we start, we need to understand the extent of the cleaning required.  This depends heavily on the type of device and how much data is intact. * **Data Recovery:** This is *always* the top priority.  If data is missing, the whole process is impacted. We'll need to determine what data is recoverable, and if it's possible to recover all data. * **Identify the Problem:** What's wrong?  Is it just dust and grime, or are there issues like:     * **Bad Sectors:**  Can we detect bad sectors on the drive?     * **Fragmentation:** Are files spread out, making them difficult to access?     * **Overheating:**  Is the drive hot or struggling to stay cool?     * **Dirty/Dirty:**  Is the drive actively trying
Q36_BaseModel	Base_Model	How do Google Cloud and Google Workspace address key management for data at rest?	ata at rest with Google Cloud and Google Workspace. It's a crucial part of a robust security and compliance strategy. Here's a breakdown of how Google Cloud and Google Workspace approach this, and how they differentiate themselves:  **The Big Picture: Understanding Key Management & Data at Rest**  Traditionally, key management for data at rest was a complex, manual process  relying on organizations to manage encryption keys, and then to ensure those keys were actually rotated and securely updated. Google Cloud and Google Workspace offer a more streamlined and automated approach, centered around key lifecycle management, rather than relying solely on a central key server.  **1. Google Cloud's Key Management Strategy:**  * **Cloud Key Management Key (CKK):** This is Google Cloud's primary system for managing keys. It's designed for a multi-tenant, cloud-native approach.     * **Key Distribution:** Instead of sending keys to individual users or applications, Cloud Key Management Key distributes keys to *all* users accessing Google Cloud resources. This means a central, secure, and easily accessible key for the entire organization.     * **Encryption:**  Key management algorithms for encryption keys are sophisticated.  They utilize Google'
Q37_BaseModel	Base_Model	What is the process for deleting data in Google's infrastructure?	and handles data deletion  a complex and crucial process! Here's a breakdown of what happens, from the top down, and why it's important:  **1. The Overview - What's Being Dealt with?**  Google doesnt just delete data in a simple "delete this" type of process. They're dealing with incredibly large, persistent, and complex datasets  think billions of records across various Google products.  Instead of deleting everything, they focus on *retention*, ensuring they can still serve users and operate their services.  **2. The Multi-Layered Approach - Where It All Happens**  This is a high-level process  the specifics vary based on the data type and the stage of the deletion process.  Here's a breakdown of the steps, often happening in the background:  *   **Tiering & Queuing:** This is the foundation. Google uses a sophisticated system to categorize data based on importance and lifecycle. Data is classified into tiers based on age, usage, and relevance to Googles business. *   **The Archive Layer:** This is the core of what's actually being moved to a storage location for long
Q38_BaseModel	Base_Model	How does Google secure communication between the internet and its services?	y impressive and complex system, and it's built on a lot of layers. Here's a breakdown of how Google secures communication between the internet and its services:  **The Big Picture: The Distributed Network**  Instead of a single, central point like a traditional website, Google operates on a decentralized network. This is crucial for resilience and scalability. Heres the breakdown:  1. **The Global Network:**  Google doesn't have a single central point of control. Instead, they have a massive, distributed network of servers and data centers around the world. This network is constantly evolving.  2. **The Core of the System: The Google Network (aka Google-Scale)** This is the central layer that manages the overall communication. It's a massively distributed system using peer-to-peer communication. Think of it like a giant, incredibly dense, interconnected web.  **How it Works - The Layers of Security & Communication**  Heres a simplified explanation of the key aspects:  *   **Initial Crawling:** When you type a search query, your browser sends a request to Googles servers. This initial request isn't just a simple "look
Q39_BaseModel	Base_Model	What is the Google Front End service and how does it function?	Service (formerly known as Google Core) and how it works.  **What is Google Front End Service?**  At its core, Google Front End Service (now just called "Front End") is a powerful, *transparent* way to serve web assets (images, videos, CSS, JavaScript) to Google's servers.  Instead of having your website load all the files directly from your origin server (the server where your website is hosted), Front End services let Google optimize and serve these assets from Google's servers, significantly improving loading speed and overall website performance for users.  **Here's a breakdown of what it is and how it works:**  **1. The Problem Before Front End:**  * **Traditional Approach (Traditional Web Hosting):** Traditionally, when someone visited your website, their browser would request all the CSS and JavaScript files directly from your origin server. This meant users could see images *before* the HTML of the page loaded, leading to a jarring experience and a potentially unpleasant page load.  This was incredibly frustrating for users.  **2. The Google Front End Model:**  * **The Core Concept:** Front End services allow Google to serve *pre-loaded* versions
Q40_BaseModel	Base_Model	What are Cloud Front Ends and how do they relate to customer VMs in Google Cloud?	tomer Virtual Machines, and how they connect to each other and your Google Cloud environment.  **What are Cloud Frontends?**  At its core, Cloud Frontends is Google Cloud's entry point for your web and mobile experiences.  Instead of building and managing your own infrastructure, you can leverage Google's global CDN (Content Delivery Network) to serve your content to users  think of it as a digital storefront for your website or app  without the overhead of servers, updates, and scaling.  Heres a breakdown:  * **What it is:** Cloud Frontends is a managed, serverless service that lets you serve content to users across multiple devices and locations. It's fundamentally a CDN that handles:     * **Content Delivery:**  It stores and delivers content (images, videos, stylesheets, JavaScript, etc.) to users based on their location  using Google's edge network.     * **Global CDN:** It's distributed globally, minimizing latency for users worldwide.     * **Serverless:**  You don't have to worry about the underlying infrastructure.  Google handles scaling, maintenance, and updates.  **How does it relate to Customer VMs in
Q41_BaseModel	Base_Model	How does Google protect its infrastructure from DoS attacks?	its massive infrastructure from Distributed Denial-of-Service (DDoS) and other attacks. Its a constantly evolving battle, and they employ a multi-layered approach  its a massive, complex system! Here's a breakdown of their strategies:  **1. Detection & Mitigation - The First Line of Defense**  * **Intrusion Detection Systems (IDS):** Google constantly monitors network traffic for unusual patterns  these are like a digital detective trying to find strange activity. They use sophisticated systems to detect patterns that suggest a DDoS attack. This includes monitoring:     * **Traffic Volume:**  They track how much traffic is flowing through Google's network at different times.  A sudden surge in traffic, especially from unusual sources, can be a red flag.     * **Protocol Anomalies:** Theyre looking for unusual protocols (like TCP/IP) being used in unexpected ways.     * **IP Address Distribution:**  They want to understand the origin and distribution of traffic  is it coming from a single IP, or many smaller ones? * **Blacklisting and Whitelisting:** They have extensive blacklists of known malicious IPs, IP ranges, and malicious websites that
Q42_BaseModel	Base_Model	How does Google's central identity service contribute to secure communication?	Identity Service (CIS) contributes to secure communication, especially in the context of multi-factor authentication (MFA) and identity management.  **The Core Idea: Secure Communication, Layered & Decentralized**  CIS fundamentally shifts away from a traditional, centralized system of identity management. Instead, it's designed to create a decentralized, secure, and robust communication infrastructure for applications and services. Here's how it fits into secure communication:  **1. Federated Authentication and Authorization:**  * **Instead of a single central point of control, each application or service can authenticate and authorize *its own* user.**  CIS lets applications talk to each other *without* needing to go directly to Google's servers.  Instead, applications present a request to a trusted entity  a 'gateway'  for verification. * **Federation:** This allows applications to determine *which* service can access which information or actions without having to trust Google's central database. Think of it like a 'delegation' system.   **2.  Multi-Factor Authentication (MFA) for Communication:**  * **Beyond just passwords:** CIS doesn't just focus on user passwords. It leverages a series
Q43_BaseModel	Base_Model	What are some security measures for user authentication?	r user authentication  protecting your users from unauthorized access and potential threats! Here's a breakdown of best practices, categorized for different levels of consideration:  **1. Basic Authentication - The Foundation**  *   **Strong Passwords:** This is always the first line of defense.  Users should choose strong passwords that are:     *   Long (at least 12 characters is often recommended)     *   A mix of uppercase, lowercase letters, numbers, and symbols.     *   Avoid common words or patterns.     *   Don't reuse passwords across multiple sites. *   **Multi-Factor Authentication (MFA):** This is *highly* recommended.  It adds an extra layer of security by requiring users to verify their identity through something *besides* the password. Examples include:     *   **One-Time Passwords:**  A code sent to the user's phone (OTP) or a device verification.     *   **Biometrics:** Fingerprint scanners, facial recognition.     *   **Push Notifications:** Login requests via mobile app. *   **Password Reset:** Regularly reset passwords for users after a suspected login attempt or after a breach
Q44_BaseModel	Base_Model	How does Google ensure safe software development?	res the safe and sound development of their software  a really impressive and constantly evolving effort! It's a massive and multi-faceted approach, rooted in a culture and a technology that prioritize security. Here's a breakdown of their strategies:  **1. Security Mindset - The "Security by Design" Philosophy:**  * **Security Starts Early:** This is *huge*. Google isn't just looking at security after the code is written; they actively consider security *throughout* the entire development lifecycle. * **Security Champions:** They have a dedicated group called the "Security Champions" - incredibly diverse and highly skilled team  that represents a significant portion of the company. They represent the perspective of the user and work closely with various teams to identify security risks.   **2. Key Pillars of Their Security Practices:**  * **Comprehensive Testing:** This is *massive*.  They do this in several ways:     * **Automated Testing:** They use tons of automated tests at every stage  unit tests, integration tests, end-to-end tests, security scanners, and more.  Theys constantly monitoring for vulnerabilities.     * **Real-World Penetration Testing:** Google actively simulates
Q45_BaseModel	Base_Model	What is Google's Vulnerability Rewards Program?	ty Rewards Program.  **What it is:**  Google's Vulnerability Rewards Program is a fantastic initiative focused on finding and rewarding security researchers who responsibly disclose vulnerabilities they discover in Google's infrastructure  think of it as a way to actively engage the security community and improve Google's defenses.**  Here's a breakdown of what it's all about:  **1. The Core Concept:**  * **"The Bug Bounty" - The Foundation:**  The program began with the "Bug Bounty" campaign, which started in 2017 and has evolved. Researchers are given clues about vulnerabilities, and they try to exploit them. * **The Reward:**  Google *rewards* researchers for finding vulnerabilities. This is a huge incentive, as the vulnerability can be exploited to improve security for *all* Google users, not just the researchers.  **2. How it Works:**  * **Researchers Find Vulnerabilities:** Researchers are given clues  often in the form of code snippets, documentation, or a "spec"  to help them find and report vulnerabilities. * **Google Accepts and Validates:** Google then checks the reported vulnerabilities, verifies them, and publishes the results. This
Q46_BaseModel	Base_Model	What is Project Zero and how does it contribute to security?	it contributes to cybersecurity.  **What is Project Zero?**  Project Zero is a significant and relatively recent initiative spearheaded by Google, focusing on **identifying and mitigating zero-day exploits  those extremely rare attacks that haven't been seen before.**  Instead of just patching existing vulnerabilities, Project Zero proactively hunts for new, unknown threats before they can impact systems.  Here's a breakdown:  * **The Problem:**  Traditional security primarily focused on patching vulnerabilities that developers had to code into software. Zero-day attacks are different. They're attacks that leverage previously unknown threats  code or concepts  that haven't been presented to security teams.  This is incredibly difficult because they're *not* based on known attack patterns. * **The Core Concept:** Project Zero operates on a "threat hunting" model. They build a massive database of internet activity from billions of users, looking for patterns that are *unexpected* and *unusually aggressive*. Theys not just looking for known exploits; they're looking for anomalous behavior that could indicate a new attack. * **The Process:** This involves:     * **Analyzing User Behavior:** They track what users are *actually
Q47_BaseModel	Base_Model	How does Google protect its source code?	what complex question! Here's a breakdown of how Google protects its source code, and how they've developed sophisticated methods to do that, focusing on the most important aspects:  **1. The Philosophy: "Open Anyway" & the "Secret Garden"**  * **The Core Idea:** Google's primary goal isn't just to *hide* the code  it's to *understand* it.  They believe in "Open Anyway," a philosophy that emphasizes transparency and collaboration to help others understand and improve the system, rather than shielding it completely. This aims to foster innovation at a much larger scale. * **The Secret Garden:** This is the core of their approach. They've built a massive, incredibly detailed, and constantly evolving "Secret Garden"  a digital ecosystem that represents the entire Google codebase in a surprisingly accessible way. Think of it like a massively interconnected, constantly updated encyclopedia of code.  **2. How it Works - Layers of Protection**  Here's a breakdown of the strategies they use, often revealed through various ways:  * **The Google Public Project (the 'Cloud')**: This is the foundation.  Its a massive cloud-based system that
Q48_BaseModel	Base_Model	What are the key functions of Binary Authorization for Borg (BAB)?	Binary Authorization (BAB) in the context of Borg.  **What is Binary Authorization (BAB)?**  Binary Authorization (BAB) is a key-based security model developed by Google, specifically for securing access to containerized applications. It's a fundamentally different approach to container security compared to traditional approaches like container registries and scanning.  Here's a breakdown of its core functions:  **1. Core Concept -  Key-Based Authorization**  * **Keys:** Each container's key is a unique identifier for its access control. Think of it like a password for a container.  The key is how the container is identified and distinguished from other containers. * **Security Policies:** The BAB allows you to define policies that govern what a key can *read* and *execute* within a container. This is a crucial part of the "authorization policies."   **2. Key Functions & How They Work:**  * **Encryption:** BAB uses encryption to protect the keys and their contents.  This means that even if a container is compromised, the attacker would need the correct decryption key to access the container's storage and other resources. * **Key-Based Access Control:** The BAB model
Q49_BaseModel	Base_Model	How does Google protect its employees' devices and credentials?	employees' devices and credentials  its a HUGE priority! Its a complex and constantly evolving system, but here's a breakdown of how Google tackles this:  **The Big Picture - A Multi-Layered Approach**  Google doesn't just rely on a single "security system"  its built on a massive, distributed network of security practices. Here's a breakdown of what they're doing:  **1. Device Protection - Beyond just wiping:**  * **Device Security - The Foundation:**  Google *strongly* emphasizes device security. They dont just wipe everything at the end of the day. Instead, they focus on proactive security, considering the entire device lifecycle.  This includes:     * **Endpoint Detection & Response (EDR):**  Google uses advanced surveillance tools to constantly monitor device activity for suspicious behavior, malware, and unauthorized changes. This isn't just about scanning; it's about *learning* from the data.     * **Device Hygiene:** Theyve gone beyond basic wiping. They can now track the entire device's activity on the network, from boot-up to ongoing operations, to detect threats.
Q50_BaseModel	Base_Model	How does Google reduce insider risk?	k at Google. Its a HUGE deal, and they're constantly working on it! Heres a breakdown of their approach, based on public information and reports:  **The Core Principle: "Transparency & Continuous Learning"**  Google's core strategy isnt just about implementing rules and controls; its about a fundamentally shift in how they approach risk. Theyre moving *away* from strict control and *into* a culture of continuous learning and transparency to mitigate insider risk.**  Heres a breakdown of their efforts, broken down into categories:  **1. Data & Information Flow - The First Line of Defense**  * **Data Audits:** Google has incredibly robust data audits, including:     * **Audit Trails:** They meticulously track *every* data movement within the systems. This allows them to see *how* data is being used, who's accessing it, where it's going, and what the intent is. This goes beyond just who has access to data; it's about understanding the *context* of the data's use.     * **Data Lineage:** They track the entire lifecycle of data: creation, usage, modifications
Q51_BaseModel	Base_Model	How does Google log and monitor employee access to end-user information?	lex question! Google's approach to employee access logging and monitoring is incredibly nuanced and a core part of their security and compliance strategy, far beyond just tracking who's *on* a machine. Here's a breakdown of how they do it, keeping in mind it's not a simple "black box" system.  **The Core Idea: "Trust Mapping"**  Instead of just logging activity, Google focuses on building a "trust map"  an understanding of which users have access to what *sensitive* data and systems, and how that access is actually being used, and what the *intent* behind those uses. This is driven by Google's "Trust Principles"  a set of principles designed to guide ethical AI development and ensure users' privacy.  Here's a breakdown of the layers and techniques:  **1. Data Logging - Beyond Basic Access:**  * **What's Logged?** Google doesn't just log *what* they're accessing, but also *how* they're accessing it. This includes:     * **What data is being accessed:** Not just listing files opened, but also the *specific* data being viewed/analyzed (e
Q52_BaseModel	Base_Model	What measures does Google Cloud take to protect user data and establish trust?	tment to protecting user data and building trust. Its a multi-faceted approach, built on a foundation of principles and practices. Heres a breakdown of what they do:  **1. Data Encryption & Security - The Foundation:**  * **Encryption at Rest:** Data is encrypted at rest, both in transit (when being sent) and at rest in Google Cloud storage. This means even if someone intercepts data while it's being stored, it's unreadable. This includes encryption for data in databases, object storage, and other services. * **Encryption in Transit:** All data transmitted between your applications and Google Cloud is encrypted using HTTPS. This is critical for secure communication. * **TLS/SSL:**  All connections to Google Cloud services (like APIs) are secured with TLS/SSL.  **2. Identity & Access Management (IAM - Identity and Access Management):**  * **Principle of Least Privilege:** This is *huge*. Google Cloud lets you define granular permissions for each user and service. This means you can only give users the *minimum* access they need to perform their tasks.  Think: "Only show me those data," not "Give me access to
Q53_BaseModel	Base_Model	What is the Threat Analysis Group and how does it contribute to security?	nalysis Group is, and how it contributes to security:  **What is a Threat Analysis Group?**  At its core, a Threat Analysis Group is a dedicated team that systematically investigates potential security threats to an organization. Its more than just looking at a security audit; it's a proactive, continuous process of identifying, evaluating, and assessing threats.  Instead of just reacting to incidents, it focuses on preventing them.  **Here's a breakdown of what a Threat Analysis Group typically does:**  * **What They Do:**    * **Threat Intelligence Gathering:**  They collect data from various sources to understand current and potential threats.** These sources include:**         * **Threat Intelligence Feeds:** They get information about emerging threats, vulnerabilities, and vulnerabilities from threat intelligence feeds (news, social media, blogs, vulnerability reports, etc.).         * **Security Logs:**  Analyzing logs from firewalls, intrusion detection systems (IDS/IPS), endpoint detection and response (EDR) systems, server logs, and cloud logs.         * **Vulnerability Scanning:** Regularly scan systems and networks for known vulnerabilities.         * **Penetration Testing (Sometimes):**  Simulate attacks
