ID	Category	Question	Answer_Text
Q154_BaseModel	Base_Model	What is the role of security audits in Google's infrastructure security?	audits in Google's infrastructure security. It's a massively complex and multifaceted effort, and it's far more than just a simple audit report. Here's a breakdown of what Google does and how they approach it, focusing on the crucial aspects:  **1. The Big Picture  Google's Security Philosophy & Audit Focus**  * **Defense-in-Depth (DoD):** Googles core philosophy is to build systems that can withstand a lot of attack surfaces.  Security audits are a *critical* part of that. They dont just look at individual systems; they want to understand the *entire* system, from the network to the data, to ensure the protection at every layer. * **Beyond Compliance: It's about Trust** Google doesn't just adhere to regulations like HIPAA or GDPR  it wants to build trust  and that trust comes from demonstrating a genuinely secure and resilient environment.     **2. What Google Does in Security Audits (Scale & Scope)**  * **Comprehensive Network-Wide Audits:**  This is the core of the audit process. They do these audits on *everything*  not just server-side. This includes
Q155_BaseModel	Base_Model	How does Google balance the need for security with the need for user privacy?	tant topic right now! It's a constant balancing act, and it's a really tricky one for Google (and, frankly, for everyone!)  Let's break down how Google tries to balance security and privacy, and why it's so challenging.  **The Core Conflict:**  * **Security - What's at risk?** Google wants to protect its users from malicious actors  hackers, governments, foreign interference, and data breaches. This means they need to know *everything* about users  their browsing history, location, contacts, search queries, device data, even their IP addresses. This is how they build their massive, incredibly detailed picture of each user. * **Privacy - What's the cost?** Privacy advocates argue that this level of tracking is intrusive and could be used for surveillance, manipulation, or worse. They want users to have control over their data.   **How Google Approaches the Balancing Act:**  Here's a breakdown of the strategies they use, and why it's so complex:  1. **Privacy-Focused Research:** Theyve invested heavily in research that aims to reveal less data while still providing useful insights.  Google can analyze patterns and
Q156_BaseModel	Base_Model	What are some of the ethical considerations involved in Google's security practices?	tions surrounding Google's security practices  its a really complex and often debated area! Here's a breakdown of the key points, covering a lot of grey areas:  **1. Data Collection & Privacy (The Biggest Concern)**  * **Massive Data Gathering:** Google collects *massive* amounts of data  think billions of user profiles, browsing history, location data, search queries, location data, purchase history, communications, etc. This data is crucial for their algorithms and business models, but it raises huge privacy concerns. * **"Privacy Washing":** Google heavily promotes the idea that they're offering users a "clean" and private experience, but this can be a deceptive tactic.  They constantly advertise data collection, making users less aware of how their data is being used and potentially influencing their choices. People often don't understand the implications of sharing this data. * **Differential Privacy:** They're experimenting with techniques like differential privacy to hide individual data points when analyzing aggregated patterns. This gives them a way to analyze large datasets without revealing sensitive information about individual users. However, it's a delicate balancing act  they want to avoid the "noisy" effect of analyzing aggregated patterns.
Q157_BaseModel	Base_Model	How does Google communicate security risks and incidents to its users?	tes security risks and incidents to its users  and what that looks like in practice. It's a really well-considered and layered approach, aiming to keep people informed while protecting privacy and minimizing the potential for harm. Here's a breakdown of how Google handles this:  **1. Multiple Layers of Communication - The Core Strategy**  * **Google Safety & Security Blog:** This is their primary frontline. Google posts a *daily* blog with updates on:     * **Security Highlights:** They share prominent security findings, including new vulnerabilities, exploits, and trends.  They often provide details about the threat actors behind the attack.     * **Incident Summaries:**  They provide a detailed account of major incidents, categorized by severity (Critical, High, Medium, Low). This helps users understand the scale and impact.     * **Security Research:** They often post about new research that informs security best practices, like new techniques attackers use, or insights into vulnerabilities.     * **Tooling:** They showcase security-focused tools, like how Googles security team defends against attacks.     * **Security News:** They offer news about new vulnerabilities that impact the broader web, showing how Google is working
Q158_BaseModel	Base_Model	What are some of the key takeaways from Google's approach to security for other organizations?	ch to security, considering its influence and what's considered best practice for organizations looking to build secure systems:  **Core Philosophy & Underlying Principles:**  At the heart of Google's security approach is a combination of these key principles:  * **Privacy as a Foundation:** They prioritize privacy deeply. They've explicitly stated that privacy is *not* just about data protection; it's about control over data. This influences everything from search results to how products are designed. * **Security Should Be Built-In:** They believe security shouldn't be added as an afterthought; it should be foundational to the design of products and services. This contrasts with many organizations that focus solely on reactive security (responding to breaches after they happen). * **Breadth of Security:** They are concerned with every aspect of the system  hardware, software, people, and even the very data itself.  **Key Areas & Strategies (Based on their Public and Public Demonstrations):**  Here's a breakdown of the most important aspects:  **1. Data Minimization & Privacy First:**  * **Privacy First:** Google consistently emphasizes data minimization  minimizing the amount of data collected, processed, and stored.
Q159_BaseModel	Base_Model	How does Google leverage its size and resources to improve security?	rages its massive size and resources to improve security  its a really complex and constantly evolving process! Here's a breakdown of their approach, focusing on different layers and aspects:  **1. Data  The Foundation of Everything**  * **Massive Data Harvest:** Google collects *enormous* amounts of data  virtually everything. This isn't just about spam or user activity; its about everything. They've built a nearly complete record of internet traffic, search queries, user behavior, malware samples, vulnerabilities, code, and even the dark web. * **Threat Intelligence & Anomaly Detection:**  Theyre constantly analyzing this vast data stream for patterns, anomalies, and potential threats.  They use AI/ML to spot unusual patterns that could indicate a security breach, malicious activity, or vulnerabilities in their systems. * **Google Threat Intelligence:** This is their core offering. They'toolize the entire internet. They're constantly scanning the web for threats, vulnerabilities, and emerging trends  think of it as a massive, real-time security sandbox.  **2. Key Areas of Focus & Improvements**  * **Vulnerability Research & Prioritization:** Google constantly
Q160_BaseModel	Base_Model	What are some of the unique challenges faced by Google in securing its infrastructure?	lenges Google faces in securing its incredibly complex and sprawling infrastructure, going beyond just a simple "security threat" story. Its a massive, constantly evolving problem! Here's a breakdown of those challenges, categorized for clarity:  **1. The Scale & Complexity of the Ecosystem**  * **Massive Scale:** Google has *hundreds of billions* of data points  users, devices, servers, services, APIs, third-party integrations  all interacting with each other. Scaling this to billions of users is a monumental logistical challenge.  Think about the sheer volume of data moving through the network  its incredibly difficult to track and secure across everything. * **Deeply Integrated Systems:** Google runs on a fundamentally integrated ecosystem. Everything  search, Gmail, Maps, Android, Google Assistant, YouTube, Photos, Cloud Storage  is interconnected. Security problems in one area can ripple outwards, affecting the entire system. * **Edge of the Network:** They've built a massive global network, including a lot of edge devices (Android phones, Nest devices, Google Home appliances, etc.)  each with potentially different attack vectors. Maintaining consistent security across this massively distributed, constantly-shifting landscape is incredibly
Q161_BaseModel	Base_Model	How does Google ensure the security of its user data in the event of a data breach?	ntly evolving topic! Google has a multi-faceted approach to data security and disaster preparedness in the event of a data breach, and it's a pretty impressive, complex system. Here's a breakdown of how they tackle it:  **1. Prevention  Before a Breach:**  * **Data Loss Prevention (DLP):**  This is HUGE. They constantly scan for patterns and anomalies that could indicate a potential breach before it happens. This includes:     * **Monitoring for unusual data transfers:** Google analyzes how data is being accessed, moved, and shared, looking for unexpected patterns that could indicate a large-scale data exfiltration.     * **Anomaly detection:** They use AI and machine learning to analyze vast amounts of data for unusual activity  looking for patterns that indicate a targeted attack, such as trying to access sensitive data that might be trying to gather information for a breach.     * **Sandboxing:** Google tries to understand what it's operating in. This means running data through simulated environments to see how it would react to an attack, enabling them to quickly identify if something is out of bounds. * **Encryption:**  They encrypt data at rest (stored on their servers) and in transit
Q162_BaseModel	Base_Model	What are some of the key factors that contribute to Google's success in security?	its impressive security record  and why its so well-regarded. It's a multifaceted approach, not just about one thing! Here's a breakdown of the key factors:  **1. Proactive, Holistic Approach - Not Just Reactive**  *   **Security is a Business Imperative:** Google understands security isn't just about preventing attacks; it's about enabling innovation and maintaining the trust of billions of users. They actively work to prevent problems *before* they arise. *   **Layered Security:** They don't just focus on individual security products (like firewalls). Its about a comprehensive picture - a huge, constantly evolving network of security teams across numerous teams.  **2. The Five Pillars of Security - Core to Googles Strategy**  This is the cornerstone of their approach. Google publishes all their security research publicly, making it freely available.  *   **Privacy First:**  They've built a fundamentally different approach to privacy  they prioritize user privacy above all else. This drives innovation in privacy-preserving technologies (like Federated Learning, Differential Privacy) because they aren't focused on collecting raw data for massive surveillance. *   **Security
Q163_BaseModel	Base_Model	How does Google balance the need for security with the need for innovation?	y, there's a constant balancing act! It's a really tricky thing for companies like Google, and I think its a really important thing to understand. Here's how I see it, broken down into key points:  **The Core Problem:**  The core problem is that too much emphasis on security can stifle innovation. Imagine if Google just wanted to protect itself from every single threat, even the good ones  it would be impossible to build new things, experiment with new ideas, and take risks.  Security is absolutely vital, because of the potential damage that a major security breach could cause  not just financial, but also to people's lives and data.  But if we only prioritize security to the point of being overly cautious, we risk losing the ability to push boundaries, develop new services, and stay competitive.**  **Google's Approach (and Why It's a Balancing Act):**  Here's what they seem to be doing, and where I think they're subtly shifting:**  1. **The "Security-First" Approach:** Google's strategy has evolved from a primarily security-focused model to more of a *layered* approach. They're
Q164_BaseModel	Base_Model	What is the importance of security awareness training for Google employees?	curity awareness training for Google employees! Its absolutely vital and goes far beyond just protecting data. Here's a breakdown of why it's so important for Google, and for you too:  **1. Protecting Google's Reputation & Business - The Bigger Picture**  * **Protecting Sensitive Data:** Google handles *massive* amounts of data - user data, intellectual property, customer information, research, code, internal systems - it's incredibly valuable. A data breach can have devastating consequences for Google, impacting everything from PR to potential legal issues to the bottom line. Training ensures employees are taking steps to protect this information. * **Maintaining Trust:**  Users trust Google with their information. A security breach can erode that trust, causing reputational damage and potential loss of users.  Protecting your employees means protecting the trust Google has built. * **Brand Protection:** Think about the impact of a major security incident on a user. If the entire company's reputation gets tarnished, it impacts everyone, not just the users.   **2.  Beyond Security - How It Impacts You (And Me!)**  * **Social Engineering Attacks:**  Google employees are a major target
Q165_BaseModel	Base_Model	How does Google's security strategy impact its users?	y strategy impacts its users  and more importantly, how it affects *them*. Its a complex and constantly evolving area, and it's a bit of a balancing act. Heres a breakdown of their approach and its implications for you:  **1. Google's Core Philosophy & Security Strategy - The Big Picture**  * **Privacy as a Foundation:** Googles core belief is that privacy is *essential* to their success. They've built a system that prioritizes privacy *above* all else. This isn't about blocking *all* data; it's about minimizing data collection, giving users control, and building trust.** * **Privacy by Design:** They constantly strive to design systems that respect user privacy. Think about things like:     * **Privacy-Preserving Recommendations:** When you're shown ads, Google tries to show you relevant ads based on your past behavior *without* tracking your browsing history. This is a big deal because it gives you more control.     * **Data Minimization:** Google collects *only* the data they *absolutely* need for its services  not everything. They're constantly evaluating what data they are collecting and
Q166_BaseModel	Base_Model	What are some examples of security features available in Google services?	ailable in Google services!  Its a really impressive and constantly evolving system. Here's a breakdown of what's going on under the hood, broken down by different areas:  **1. Privacy & Data Security  The Foundation**  * **Privacy Controls:** This is huge. Google actively works to give you control over your data.     * **Privacy Settings:** You can completely disable tracking cookies, manage your Google Activity History, set default settings for data collection, and manage which types of data Google collects.     * **Privacy Dashboard:** You can see all the data Google is collecting about your browsing and activity. This lets you understand whats happening.     * **Data Minimization:** Google is committed to only collecting and storing the data that's *necessary* for providing core services. Theyre generally prioritizing privacy.     * **Opt-Out:** You can opt out of personalized advertising (which impacts data collection, but also a core value for users).   **2. Security & Protection  Keeping Things Safe**  * **Two-Factor Authentication (2FA):** This is *critical*. It's a must-have for everyone.  Even if someone steals
Q167_BaseModel	Base_Model	How does Google address the security challenges posed by emerging technologies?	x question! Google's approach to addressing the security challenges posed by emerging technologies is a multi-pronged strategy focused on a few key areas:  **1. Proactive Research & Security Team (The Big Picture)**  * **Core Research Focus:** Google has a massive, dedicated research team focused on understanding the risks of new technologies. They're not just looking at vulnerabilities; they're trying to predict the *impact* of these technologies on society. * **The "Security by Design" Initiative:** This is a huge, ongoing effort. Google doesn't just build security *after* a vulnerability is discovered. They proactively build security into the very fabric of their products and infrastructure *from the very beginning*.  They're constantly researching how different technologies can be used maliciously, and then finding ways to mitigate the potential risks before they'gently roll out harm.  They've worked very hard to ensure that new features and functionalities of new technologies (like AI, web3, etc.) are thoroughly tested for security *before* they are released to users. * **Specifically looking at:**     * **AI Security:**  A huge priority. They are researching adversarial attacks against AI models, the potential
Q168_BaseModel	Base_Model	What are some of the key challenges faced by Google in securing its mobile devices?	ges Google faces when securing mobile devices, considering the unique environment they operate in  mobile devices are notoriously vulnerable and complex.  Its a constantly evolving field!  **Overall Picture:**  Google is *obsessed* with mobile security. It's the cornerstone of their entire strategy. They're not just building security *around* mobile; they're actively trying to design the mobile experience with security in mind.  **Here's a breakdown of the main challenges:**  **1. The Mobile Ecosystem - a Wild, Distributed World**  * **The Attack Surface is HUGE:**  Mobile devices run on a massive, deeply interconnected ecosystem: apps, services, cloud, IoT, and the Internet of Things. Every app, every server, every device contributing to the overall attack surface. Google doesn't just want to protect *one* app; they want to protect *everything*. * **Android's Complexity:** Android is notoriously difficult to secure. It's open-source, deeply patched, and actively fragmented. Developers often bypass security checks, and the ecosystem's open nature means vulnerabilities get exploited from many sources. * **Edge Cases:**  Mobile devices are often "jailbroken
Q169_BaseModel	Base_Model	How does Google protect user data stored in its cloud services?	user data stored in its cloud services. Its a really complex and constantly evolving system, but heres a breakdown of what theyre doing:  **1. Data Security - The Big Picture:**  * **Encryption:** This is the cornerstone of their security. All data is encrypted  both in transit (when its being sent to their servers) and at rest (stored on their servers)  protecting it from unauthorized access even if someone were to physically steal the storage.  They use various encryption methods, including TLS/SSL for web browsing and HTTPS for cloud services like Gmail, Docs, etc. * **Multi-Factor Authentication (MFA):**  They heavily rely on MFA for all accounts, which significantly reduces the risk of unauthorized access. This means you need two or more pieces of information to prove your identity - like a password *and* a code sent to your phone.  **2. Data Protection - Layers of Defense:**  * **Data Loss Prevention (DLP):** Google actively employs DLP (Data Loss Prevention) measures. This is about preventing data from leaving their systems in unexpected ways.  This includes:     * **IP Address Masking:** They subtly
Q170_BaseModel	Base_Model	What is Google's approach to data privacy?	data privacy. It's a surprisingly complex and constantly evolving one! Heres a breakdown of what they're doing and what they're *not* doing, based on their public disclosures, reports, and industry analysis:  **Overall Philosophy & Goals:**  * **Privacy-First Design:** Google's core philosophy is built around the idea that *privacy is a fundamental part of the user experience.* They genuinely believe that providing data for a better user experience is a good thing, and that good user experience is intrinsically linked to privacy. * **Minimizing Data Collection & Use:** They aim to collect *only* the data they absolutely need for their core products and services  think search, Gmail, Maps, Ads  and then anonymize and aggregate that data to a degree that users are comfortable with. Theys heavily invested in privacy-preserving technologies. * **"Privacy as a Service" (Paginated):** They're developing this idea of how users can control data access through privacy settings and "paginated" data. This is a key part of their strategy to retain control.   **Specific Strategies & Practices:**  * **Differential Privacy:** This is one of
Q171_BaseModel	Base_Model	How does Google handle user security incidents?	ntly evolving area for Google! Let's break down how they handle user security incidents and what they're doing to protect users. Its a *massive* and incredibly complex system. Here's a breakdown of their approach, based on public information and known practices:  **1. Detection & Monitoring  The Constant Vigil**  * **Real-time Monitoring:** Google constantly monitors user activity across their massive infrastructure. They use a huge range of tools to detect potential issues:     * **Security Teams:** Dedicated teams constantly scan for unusual patterns  fraudulent activity, attempted breaches, probing for vulnerabilities, etc.     * **Machine Learning:** Theyre increasingly using AI and machine learning to analyze massive amounts of data for anomalies  things that look *too* good to be true (like unusually high search patterns, unusual data requests, or a sudden spike in activity that *could* be a security threat).     * **Threat Intelligence:** They have a network of feeds into threat intelligence feeds  partnering with organizations like CrowdStrike, FireEye, etc. to stay informed about emerging threats, attacks, and vulnerabilities.     * **User Behavior Analytics:** They've been expanding into this area - they're
Q172_BaseModel	Base_Model	What is Google's approach to security research?	earch approach! Its a really fascinating and quite complex area, and it's a huge part of what they do. Heres a breakdown of what I understand about their approach, drawing from various sources and reports:  **1.  The Core Philosophy: Proactive, Not Reactive**  Googles security research is fundamentally different from just reacting to attacks. Theyre striving for *proactive* security, aiming to build a defense against threats *before* they happen. This is a radical shift from a purely defensive model.  **Heres the breakdown of their approach:**  * **Beyond Black Boxes  Understanding Attack Vectors:** Instead of just trying to block known attacks, theyre focused on *understanding* how attackers think and how they *want* to attack. This is done through extensive, deep analysis of attack patterns, not just against specific systems.     * **Attack Simulation:** They create incredibly detailed, simulated environments to model attacks. This includes not just the data, but the entire attackers perspective  what are they trying to achieve, how do they exploit vulnerabilities, what are their techniques?     * **Reinforcement Learning & Online Learning:** Google leverages reinforcement
Q173_BaseModel	Base_Model	How does Google balance security and innovation in its product development?	n debated question! Google has a very deliberate and complex approach to balancing security and innovation  its a constant negotiation, and its a *massive* undertaking. Here's a breakdown of how they do it, and why its so challenging:  **The Core Philosophy: "Security Through Extensive Testing"**  At the heart of Google's approach is the idea that security isn't just about preventing attacks; it's about building a system that *can* handle the most robust and complex attacks possible. They've moved away from a simple "firewall" approach and embraced a far more holistic strategy.  Here's how they prioritize it:  **1. The "Security Through Deep Monitoring" Approach:**  *   **Every Piece of Google is Under Constant Surveillance:**  Instead of just looking at individual code, they'tly monitor *everything*. Think of it like a massive, incredibly detailed, multi-layered surveillance system for the entire platform. This includes:     *   **Massive Data Collection:** They gather data from countless sources  network traffic, system logs, user activity, search queries, developer tools  all to understand how Google operates. This data is invaluable
